{
  "$schema": "https://json-schema.org/draft/2020-12/schema",
  "$id": "https://chargesentinel.local/schemas/availability_input.schema.json",
  "title": "Availability prediction input",
  "type": "object",
  "additionalProperties": false,
  "required": ["charger_id", "location", "district", "session_start", "as_of"],
  "properties": {
    "charger_id": {"type": ["string", "integer"]},
    "location": {"type": "string", "minLength": 1},
    "district": {"type": "string", "minLength": 1},
    "session_start": {"type": "string", "pattern": "^\\d{4}-\\d{2}-\\d{2}T\\d{2}:\\d{2}:\\d{2}(\\.\\d+)?([+-]\\d{2}:\\d{2}|Z)?$", "description": "ISO local timestamp; timezone suffix is optional because the source timezone is unresolved."},
    "as_of": {"type": "string", "pattern": "^\\d{4}-\\d{2}-\\d{2}T\\d{2}:\\d{2}:\\d{2}(\\.\\d+)?([+-]\\d{2}:\\d{2}|Z)?$", "description": "ISO local timestamp; timezone suffix is optional because the source timezone is unresolved."},
    "temp_c": {"type": "number"},
    "humidity": {"type": "number"},
    "precip_mm": {"type": "number", "minimum": 0},
    "history_features": {
      "type": "object",
      "additionalProperties": false,
      "properties": {
        "idle_before_min": {"type": ["number", "null"]},
        "prev_duration_min": {"type": ["number", "null"], "minimum": 0},
        "hist_median_normal": {"type": ["number", "null"], "minimum": 0},
        "hist_mean_normal": {"type": ["number", "null"], "minimum": 0},
        "hist_abnormal_rate": {"type": ["number", "null"], "minimum": 0, "maximum": 1},
        "sessions_before": {"type": "integer", "minimum": 0},
        "has_history": {"type": "integer", "enum": [0, 1]},
        "site_n_chargers": {"type": "integer", "minimum": 1},
        "site_busy_others": {"type": "number", "minimum": 0},
        "site_busy_share": {"type": "number", "minimum": 0, "maximum": 1},
        "site_starts_last_60min": {"type": "number", "minimum": 0}
      }
    }
  }
}
